NAICS2022_LABEL,EMP,NAME,GEO_ID,NAICS2022,us
Support activities for agriculture and forestry,246854,United States,0100000US,115,1
Support Activities for Crop Production,222098,United States,0100000US,1151,1
Support Activities for Crop Production,222098,United States,0100000US,11511,1
Cotton ginning,5074,United States,0100000US,115111,1
"Soil Preparation, Planting, and Cultivating",26087,United States,0100000US,115112,1
"Crop Harvesting, Primarily by Machine",17420,United States,0100000US,115113,1
Postharvest Crop Activities (except Cotton Ginning),37012,United States,0100000US,115114,1
Farm Labor Contractors and Crew Leaders,128254,United States,0100000US,115115,1
Farm Management Services,8251,United States,0100000US,115116,1
Support Activities for Animal Production,24756,United States,0100000US,1152,1
Support Activities for Animal Production,24756,United States,0100000US,11521,1
Support Activities for Animal Production,24756,United States,0100000US,115210,1
"Mining, quarrying, and oil and gas extraction",545482,United States,0100000US,21,1
Oil and Gas Extraction,105987,United States,0100000US,211,1
Oil and Gas Extraction,105987,United States,0100000US,2111,1
Crude Petroleum Extraction,73852,United States,0100000US,21112,1
Crude Petroleum Extraction,73852,United States,0100000US,211120,1
Natural Gas Extraction,32135,United States,0100000US,21113,1
Natural Gas Extraction,32135,United States,0100000US,211130,1
Mining (except Oil and Gas),167334,United States,0100000US,212,1
Coal Mining,40673,United States,0100000US,2121,1
Coal Mining,40673,United States,0100000US,21211,1
Surface Coal Mining,16234,United States,0100000US,212114,1
Underground Coal Mining,24439,United States,0100000US,212115,1
Metal ore mining,40573,United States,0100000US,2122,1
Iron Ore Mining,5175,United States,0100000US,21221,1
Iron Ore Mining,5175,United States,0100000US,212210,1
Gold Ore and Silver Ore Mining,15403,United States,0100000US,21222,1
Gold Ore and Silver Ore Mining,15403,United States,0100000US,212220,1
"Copper, Nickel, Lead, and Zinc Mining",16532,United States,0100000US,21223,1
"Copper, Nickel, Lead, and Zinc Mining",16532,United States,0100000US,212230,1
Other Metal Ore Mining,3463,United States,0100000US,21229,1
Other Metal Ore Mining,3463,United States,0100000US,212290,1
Nonmetallic Mineral Mining and Quarrying,86088,United States,0100000US,2123,1
Stone Mining and Quarrying,41173,United States,0100000US,21231,1
Dimension Stone Mining and Quarrying,3742,United States,0100000US,212311,1
Crushed and Broken Limestone Mining and Quarrying,25005,United States,0100000US,212312,1
Crushed and Broken Granite Mining and Quarrying,5113,United States,0100000US,212313,1
Other Crushed and Broken Stone Mining and Quarrying,7313,United States,0100000US,212319,1
"Sand, Gravel, Clay, and Ceramic and Refractory Minerals Mining and Quarrying",34910,United States,0100000US,21232,1
Construction Sand and Gravel Mining,23957,United States,0100000US,212321,1
Industrial Sand Mining,6833,United States,0100000US,212322,1
"Kaolin, Clay, and Ceramic and Refractory Minerals Mining",4120,United States,0100000US,212323,1
Other Nonmetallic Mineral Mining and Quarrying,10005,United States,0100000US,21239,1
Other Nonmetallic Mineral Mining and Quarrying,10005,United States,0100000US,212390,1
Support Activities for Mining,272161,United States,0100000US,213,1
Support Activities for Mining,272161,United States,0100000US,2131,1
Support Activities for Mining,272161,United States,0100000US,21311,1
Drilling Oil and Gas Wells,52715,United States,0100000US,213111,1
Support Activities for Oil and Gas Operations,206632,United States,0100000US,213112,1
Support Activities for Coal Mining,3020,United States,0100000US,213113,1
Support Activities for Metal Mining,5697,United States,0100000US,213114,1
Support Activities for Nonmetallic Minerals (except Fuels) Mining,4097,United States,0100000US,213115,1
Utilities,699168,United States,0100000US,22,1
Utilities,699168,United States,0100000US,221,1
"Electric power generation, transmission and distribution",536428,United States,0100000US,2211,1
Electric Power Generation,131171,United States,0100000US,22111,1
Hydroelectric power generation,4387,United States,0100000US,221111,1
Fossil fuel electric power generation,66390,United States,0100000US,221112,1
Nuclear electric power generation,39562,United States,0100000US,221113,1
Solar Electric Power Generation,7648,United States,0100000US,221114,1
Wind Electric Power Generation,9548,United States,0100000US,221115,1
Geothermal Electric Power Generation,1347,United States,0100000US,221116,1
Biomass Electric Power Generation,2143,United States,0100000US,221117,1
Other Electric Power Generation,146,United States,0100000US,221118,1
"Electric Power Transmission, Control, and Distribution",405257,United States,0100000US,22112,1
Electric Bulk Power Transmission and Control,18710,United States,0100000US,221121,1
Electric Power Distribution,386547,United States,0100000US,221122,1
Natural Gas Distribution,106633,United States,0100000US,2212,1
Natural Gas Distribution,106633,United States,0100000US,22121,1
Natural Gas Distribution,106633,United States,0100000US,221210,1
"Water, Sewage and Other Systems",56107,United States,0100000US,2213,1
Water Supply and Irrigation Systems,47290,United States,0100000US,22131,1
Water Supply and Irrigation Systems,47290,United States,0100000US,221310,1
Sewage Treatment Facilities,6837,United States,0100000US,22132,1
Sewage Treatment Facilities,6837,United States,0100000US,221320,1
Steam and Air-Conditioning Supply,1980,United States,0100000US,22133,1
Steam and Air-Conditioning Supply,1980,United States,0100000US,221330,1
Construction,7485385,United States,0100000US,23,1
Construction of Buildings,1612709,United States,0100000US,236,1
Residential Building Construction,878951,United States,0100000US,2361,1
Residential Building Construction,878951,United States,0100000US,23611,1
New Single-Family Housing Construction (except For-Sale Builders),228700,United States,0100000US,236115,1
New Multifamily Housing Construction (except For-Sale Builders),68877,United States,0100000US,236116,1
New Housing For-Sale Builders,171442,United States,0100000US,236117,1
Residential Remodelers,409932,United States,0100000US,236118,1
Nonresidential building construction,733758,United States,0100000US,2362,1
Industrial Building Construction,77133,United States,0100000US,23621,1
Industrial Building Construction,77133,United States,0100000US,236210,1
Commercial and Institutional Building Construction,656625,United States,0100000US,23622,1
Commercial and Institutional Building Construction,656625,United States,0100000US,236220,1
Heavy and Civil Engineering Construction,1040299,United States,0100000US,237,1
Utility system construction,605695,United States,0100000US,2371,1
Water and Sewer Line and Related Structures Construction,147486,United States,0100000US,23711,1
Water and Sewer Line and Related Structures Construction,147486,United States,0100000US,237110,1
Oil and Gas Pipeline and Related Structures Construction,162989,United States,0100000US,23712,1
Oil and Gas Pipeline and Related Structures Construction,162989,United States,0100000US,237120,1
Power and Communication Line and Related Structures Construction,295220,United States,0100000US,23713,1
Power and Communication Line and Related Structures Construction,295220,United States,0100000US,237130,1
Land Subdivision,25183,United States,0100000US,2372,1
Land Subdivision,25183,United States,0100000US,23721,1
Land Subdivision,25183,United States,0100000US,237210,1
"Highway, Street, and Bridge Construction",331473,United States,0100000US,2373,1
"Highway, Street, and Bridge Construction",331473,United States,0100000US,23731,1
"Highway, Street, and Bridge Construction",331473,United States,0100000US,237310,1
Other Heavy and Civil Engineering Construction,77948,United States,0100000US,2379,1
Other Heavy and Civil Engineering Construction,77948,United States,0100000US,23799,1
Other Heavy and Civil Engineering Construction,77948,United States,0100000US,237990,1
Specialty Trade Contractors,4832377,United States,0100000US,238,1
"Foundation, structure, and building exterior contractors",960223,United States,0100000US,2381,1
Poured Concrete Foundation and Structure Contractors,274618,United States,0100000US,23811,1
Poured Concrete Foundation and Structure Contractors,274618,United States,0100000US,238110,1
Structural Steel and Precast Concrete Contractors,77724,United States,0100000US,23812,1
Structural Steel and Precast Concrete Contractors,77724,United States,0100000US,238120,1
Framing Contractors,103612,United States,0100000US,23813,1
Framing Contractors,103612,United States,0100000US,238130,1
Masonry Contractors,130295,United States,0100000US,23814,1
Masonry Contractors,130295,United States,0100000US,238140,1
Glass and Glazing Contractors,70256,United States,0100000US,23815,1
Glass and Glazing Contractors,70256,United States,0100000US,238150,1
Roofing Contractors,217014,United States,0100000US,23816,1
Roofing Contractors,217014,United States,0100000US,238160,1
Siding Contractors,42593,United States,0100000US,23817,1
Siding Contractors,42593,United States,0100000US,238170,1
"Other Foundation, Structure, and Building Exterior Contractors",44111,United States,0100000US,23819,1
"Other Foundation, Structure, and Building Exterior Contractors",44111,United States,0100000US,238190,1
Building Equipment Contractors,2280334,United States,0100000US,2382,1
Electrical Contractors and Other Wiring Installation Contractors,968734,United States,0100000US,23821,1
Electrical Contractors and Other Wiring Installation Contractors,968734,United States,0100000US,238210,1
"Plumbing, Heating, and Air-Conditioning Contractors",1169692,United States,0100000US,23822,1
"Plumbing, Heating, and Air-Conditioning Contractors",1169692,United States,0100000US,238220,1
Other Building Equipment Contractors,141908,United States,0100000US,23829,1
Other Building Equipment Contractors,141908,United States,0100000US,238290,1
Building finishing contractors,824843,United States,0100000US,2383,1
Drywall and Insulation Contractors,238637,United States,0100000US,23831,1
Drywall and Insulation Contractors,238637,United States,0100000US,238310,1
Painting and Wall Covering Contractors,191449,United States,0100000US,23832,1
Painting and Wall Covering Contractors,191449,United States,0100000US,238320,1
Flooring Contractors,85979,United States,0100000US,23833,1
Flooring Contractors,85979,United States,0100000US,238330,1
Tile and Terrazzo Contractors,59168,United States,0100000US,23834,1
Tile and Terrazzo Contractors,59168,United States,0100000US,238340,1
Finish Carpentry Contractors,177934,United States,0100000US,23835,1
Finish Carpentry Contractors,177934,United States,0100000US,238350,1
Other Building Finishing Contractors,71676,United States,0100000US,23839,1
Other Building Finishing Contractors,71676,United States,0100000US,238390,1
Other Specialty Trade Contractors,766977,United States,0100000US,2389,1
Site Preparation Contractors,482712,United States,0100000US,23891,1
Site Preparation Contractors,482712,United States,0100000US,238910,1
All Other Specialty Trade Contractors,284265,United States,0100000US,23899,1
All Other Specialty Trade Contractors,284265,United States,0100000US,238990,1
Manufacturing,12171365,United States,0100000US,31-33,1
Food Manufacturing,1646880,United States,0100000US,311,1
Animal Food Manufacturing,61902,United States,0100000US,3111,1
Animal Food Manufacturing,61902,United States,0100000US,31111,1
Dog and Cat Food Manufacturing,30337,United States,0100000US,311111,1
Other Animal Food Manufacturing,31565,United States,0100000US,311119,1
Grain and Oilseed Milling,58358,United States,0100000US,3112,1
Flour Milling and Malt Manufacturing,21720,United States,0100000US,31121,1
Flour Milling,15032,United States,0100000US,311211,1
Rice Milling,5827,United States,0100000US,311212,1
Malt Manufacturing,861,United States,0100000US,311213,1
Starch and Vegetable Fats and Oils Manufacturing,24497,United States,0100000US,31122,1
Wet Corn Milling and Starch Manufacturing,7822,United States,0100000US,311221,1
Soybean and Other Oilseed Processing,8934,United States,0100000US,311224,1
Fats and Oils Refining and Blending,7741,United States,0100000US,311225,1
Breakfast Cereal Manufacturing,12141,United States,0100000US,31123,1
Breakfast Cereal Manufacturing,12141,United States,0100000US,311230,1
Sugar and Confectionery Product Manufacturing,85839,United States,0100000US,3113,1
Sugar Manufacturing,14111,United States,0100000US,31131,1
Beet Sugar Manufacturing,7067,United States,0100000US,311313,1
Cane Sugar Manufacturing,7044,United States,0100000US,311314,1
Nonchocolate Confectionery Manufacturing,28650,United States,0100000US,31134,1
Nonchocolate Confectionery Manufacturing,28650,United States,0100000US,311340,1
Chocolate and Confectionery Manufacturing,43078,United States,0100000US,31135,1
Chocolate and Confectionery Manufacturing from Cacao Beans,9054,United States,0100000US,311351,1
Confectionery Manufacturing from Purchased Chocolate,34024,United States,0100000US,311352,1
Fruit and Vegetable Preserving and Specialty Food Manufacturing,168904,United States,0100000US,3114,1
Frozen Food Manufacturing,95157,United States,0100000US,31141,1
"Frozen Fruit, Juice, and Vegetable Manufacturing",29073,United States,0100000US,311411,1
Frozen Specialty Food Manufacturing,66084,United States,0100000US,311412,1
"Fruit and Vegetable Canning, Pickling, and Drying",73747,United States,0100000US,31142,1
Fruit and Vegetable Canning,44356,United States,0100000US,311421,1
Specialty Canning,12146,United States,0100000US,311422,1
Dried and Dehydrated Food Manufacturing,17245,United States,0100000US,311423,1
Dairy Product Manufacturing,162368,United States,0100000US,3115,1
Dairy Product (except Frozen) Manufacturing,139329,United States,0100000US,31151,1
Fluid Milk Manufacturing,59498,United States,0100000US,311511,1
Creamery Butter Manufacturing,3656,United States,0100000US,311512,1
Cheese Manufacturing,58670,United States,0100000US,311513,1
"Dry, Condensed, and Evaporated Dairy Product Manufacturing",17505,United States,0100000US,311514,1
Ice Cream and Frozen Dessert Manufacturing,23039,United States,0100000US,31152,1
Ice Cream and Frozen Dessert Manufacturing,23039,United States,0100000US,311520,1
Animal Slaughtering and Processing,535134,United States,0100000US,3116,1
Animal Slaughtering and Processing,535134,United States,0100000US,31161,1
Animal (except Poultry) Slaughtering,152843,United States,0100000US,311611,1
Meat Processed from Carcasses,140850,United States,0100000US,311612,1
Rendering and Meat Byproduct Processing,11201,United States,0100000US,311613,1
Poultry Processing,230240,United States,0100000US,311615,1
Seafood Product Preparation and Packaging,31202,United States,0100000US,3117,1
Seafood Product Preparation and Packaging,31202,United States,0100000US,31171,1
Seafood Product Preparation and Packaging,31202,United States,0100000US,311710,1
Bakeries and Tortilla Manufacturing,294416,United States,0100000US,3118,1
Bread and Bakery Product Manufacturing,219001,United States,0100000US,31181,1
Retail Bakeries,77170,United States,0100000US,311811,1
Commercial Bakeries,116608,United States,0100000US,311812,1
"Frozen Cakes, Pies, and Other Pastries Manufacturing",25223,United States,0100000US,311813,1
"Cookie, Cracker, and Pasta Manufacturing",55647,United States,0100000US,31182,1
Cookie and Cracker Manufacturing,32585,United States,0100000US,311821,1
"Dry Pasta, Dough, and Flour Mixes Manufacturing from Purchased Flour",23062,United States,0100000US,311824,1
Tortilla Manufacturing,19768,United States,0100000US,31183,1
Tortilla Manufacturing,19768,United States,0100000US,311830,1
Other Food Manufacturing,248757,United States,0100000US,3119,1
Snack Food Manufacturing,62417,United States,0100000US,31191,1
Roasted Nuts and Peanut Butter Manufacturing,19739,United States,0100000US,311911,1
Other Snack Food Manufacturing,42678,United States,0100000US,311919,1
Coffee and Tea Manufacturing,23506,United States,0100000US,31192,1
Coffee and Tea Manufacturing,23506,United States,0100000US,311920,1
Flavoring Syrup and Concentrate Manufacturing,8593,United States,0100000US,31193,1
Flavoring Syrup and Concentrate Manufacturing,8593,United States,0100000US,311930,1
Seasoning and Dressing Manufacturing,49467,United States,0100000US,31194,1
"Mayonnaise, Dressing, and Other Prepared Sauce Manufacturing",24050,United States,0100000US,311941,1
Spice and Extract Manufacturing,25417,United States,0100000US,311942,1
All Other Food Manufacturing,104774,United States,0100000US,31199,1
Perishable Prepared Food Manufacturing,74630,United States,0100000US,311991,1
All Other Miscellaneous Food Manufacturing,30144,United States,0100000US,311999,1
Beverage and Tobacco Product Manufacturing,268798,United States,0100000US,312,1
Beverage Manufacturing,257357,United States,0100000US,3121,1
Soft Drink and Ice Manufacturing,81473,United States,0100000US,31211,1
Soft Drink Manufacturing,64502,United States,0100000US,312111,1
Bottled Water Manufacturing,11040,United States,0100000US,312112,1
Ice Manufacturing,5931,United States,0100000US,312113,1
Breweries,89823,United States,0100000US,31212,1
Breweries,89823,United States,0100000US,312120,1
Wineries,63475,United States,0100000US,31213,1
Wineries,63475,United States,0100000US,312130,1
Distilleries,22586,United States,0100000US,31214,1
Distilleries,22586,United States,0100000US,312140,1
Tobacco Manufacturing,11441,United States,0100000US,3122,1
Tobacco Manufacturing,11441,United States,0100000US,31223,1
Tobacco Manufacturing,11441,United States,0100000US,312230,1
Textile Mills,80726,United States,0100000US,313,1
"Fiber, Yarn, and Thread Mills",19117,United States,0100000US,3131,1
"Fiber, Yarn, and Thread Mills",19117,United States,0100000US,31311,1
"Fiber, Yarn, and Thread Mills",19117,United States,0100000US,313110,1
Fabric Mills,40474,United States,0100000US,3132,1
Broadwoven Fabric Mills,14081,United States,0100000US,31321,1
Broadwoven Fabric Mills,14081,United States,0100000US,313210,1
Narrow fabric mills and schiffli machine embroidery,5224,United States,0100000US,31322,1
Narrow fabric mills and schiffli machine embroidery,5224,United States,0100000US,313220,1
Nonwoven Fabric Mills,16151,United States,0100000US,31323,1
Nonwoven Fabric Mills,16151,United States,0100000US,313230,1
Knit Fabric Mills,5018,United States,0100000US,31324,1
Knit Fabric Mills,5018,United States,0100000US,313240,1
Textile and Fabric Finishing and Fabric Coating Mills,21135,United States,0100000US,3133,1
Textile and Fabric Finishing Mills,14057,United States,0100000US,31331,1
Textile and Fabric Finishing Mills,14057,United States,0100000US,313310,1
Fabric Coating Mills,7078,United States,0100000US,31332,1
Fabric Coating Mills,7078,United States,0100000US,313320,1
Textile Product Mills,99981,United States,0100000US,314,1
Textile Furnishings Mills,44674,United States,0100000US,3141,1
Carpet and rug mills,25955,United States,0100000US,31411,1
Carpet and rug mills,25955,United States,0100000US,314110,1
Curtain and Linen Mills,18719,United States,0100000US,31412,1
Curtain and Linen Mills,18719,United States,0100000US,314120,1
Other textile product mills,55307,United States,0100000US,3149,1
Textile Bag and Canvas Mills,23420,United States,0100000US,31491,1
Textile Bag and Canvas Mills,23420,United States,0100000US,314910,1
All Other Textile Product Mills,31887,United States,0100000US,31499,1
"Rope, Cordage, Twine, Tire Cord, and Tire Fabric Mills",6154,United States,0100000US,314994,1
All Other Miscellaneous Textile Product Mills,25733,United States,0100000US,314999,1
Apparel Manufacturing,68393,United States,0100000US,315,1
Apparel Knitting Mills,8786,United States,0100000US,3151,1
Apparel Knitting Mills,8786,United States,0100000US,31512,1
Apparel Knitting Mills,8786,United States,0100000US,315120,1
Cut and Sew Apparel Manufacturing,51651,United States,0100000US,3152,1
Cut and Sew Apparel Contractors,22468,United States,0100000US,31521,1
Cut and Sew Apparel Contractors,22468,United States,0100000US,315210,1
Cut and Sew Apparel Manufacturing (except Contractors),29183,United States,0100000US,31525,1
Cut and Sew Apparel Manufacturing (except Contractors),29183,United States,0100000US,315250,1
Apparel Accessories and Other Apparel Manufacturing,7956,United States,0100000US,3159,1
Apparel Accessories and Other Apparel Manufacturing,7956,United States,0100000US,31599,1
Apparel Accessories and Other Apparel Manufacturing,7956,United States,0100000US,315990,1
Leather and Allied Product Manufacturing,24220,United States,0100000US,316,1
Leather and Hide Tanning and Finishing,2999,United States,0100000US,3161,1
Leather and hide tanning and finishing,2999,United States,0100000US,31611,1
Leather and hide tanning and finishing,2999,United States,0100000US,316110,1
Footwear Manufacturing,8920,United States,0100000US,3162,1
Footwear Manufacturing,8920,United States,0100000US,31621,1
Footwear Manufacturing,8920,United States,0100000US,316210,1
Other Leather and Allied Product Manufacturing,12301,United States,0100000US,3169,1
Other Leather and Allied Product Manufacturing,12301,United States,0100000US,31699,1
Other Leather and Allied Product Manufacturing,12301,United States,0100000US,316990,1
Wood Product Manufacturing,437757,United States,0100000US,321,1
Sawmills and Wood Preservation,90592,United States,0100000US,3211,1
Sawmills and Wood Preservation,90592,United States,0100000US,32111,1
Sawmills,79158,United States,0100000US,321113,1
Wood Preservation,11434,United States,0100000US,321114,1
"Veneer, Plywood, and Engineered Wood Product Manufacturing",84314,United States,0100000US,3212,1
"Veneer, Plywood, and Engineered Wood Product Manufacturing",84314,United States,0100000US,32121,1
Hardwood Veneer and Plywood Manufacturing,10561,United States,0100000US,321211,1
Softwood Veneer and Plywood Manufacturing,13371,United States,0100000US,321212,1
Engineered Wood Member Manufacturing,48456,United States,0100000US,321215,1
Reconstituted Wood Product Manufacturing,11926,United States,0100000US,321219,1
Other wood product manufacturing,262851,United States,0100000US,3219,1
Millwork,117967,United States,0100000US,32191,1
Wood Window and Door Manufacturing,62363,United States,0100000US,321911,1
"Cut Stock, Resawing Lumber, and Planing",19617,United States,0100000US,321912,1
Other Millwork (including Flooring),35987,United States,0100000US,321918,1
Wood Container and Pallet Manufacturing,64963,United States,0100000US,32192,1
Wood Container and Pallet Manufacturing,64963,United States,0100000US,321920,1
All Other Wood Product Manufacturing,79921,United States,0100000US,32199,1
Manufactured Home (Mobile Home) Manufacturing,24554,United States,0100000US,321991,1
Prefabricated Wood Building Manufacturing,23896,United States,0100000US,321992,1
All Other Miscellaneous Wood Product Manufacturing,31471,United States,0100000US,321999,1
Paper Manufacturing,347651,United States,0100000US,322,1
"Pulp, paper, and paperboard mills",88907,United States,0100000US,3221,1
Pulp Mills,9279,United States,0100000US,32211,1
Pulp Mills,9279,United States,0100000US,322110,1
Paper Mills,43170,United States,0100000US,32212,1
Paper Mills,43170,United States,0100000US,322120,1
Paperboard Mills,36458,United States,0100000US,32213,1
Paperboard Mills,36458,United States,0100000US,322130,1
Converted paper product manufacturing,258744,United States,0100000US,3222,1
Paperboard Container Manufacturing,156182,United States,0100000US,32221,1
Corrugated and Solid Fiber Box Manufacturing,91382,United States,0100000US,322211,1
Folding Paperboard Box Manufacturing,45586,United States,0100000US,322212,1
Other Paperboard Container Manufacturing,19214,United States,0100000US,322219,1
Paper Bag and Coated and Treated Paper Manufacturing,53869,United States,0100000US,32222,1
Paper Bag and Coated and Treated Paper Manufacturing,53869,United States,0100000US,322220,1
Stationery Product Manufacturing,15661,United States,0100000US,32223,1
Stationery Product Manufacturing,15661,United States,0100000US,322230,1
Other Converted Paper Product Manufacturing,33032,United States,0100000US,32229,1
Sanitary paper product manufacturing,18442,United States,0100000US,322291,1
All Other Converted Paper Product Manufacturing,14590,United States,0100000US,322299,1
Printing and Related Support Activities,379976,United States,0100000US,323,1
Printing and Related Support Activities,379976,United States,0100000US,3231,1
Printing,363932,United States,0100000US,32311,1
Commercial Printing (except Screen and Books),273019,United States,0100000US,323111,1
Commercial Screen Printing,71659,United States,0100000US,323113,1
Books Printing,19254,United States,0100000US,323117,1
Support Activities for Printing,16044,United States,0100000US,32312,1
Support Activities for Printing,16044,United States,0100000US,323120,1
Petroleum and Coal Products Manufacturing,99068,United States,0100000US,324,1
Petroleum and Coal Products Manufacturing,99068,United States,0100000US,3241,1
Petroleum Refineries,57192,United States,0100000US,32411,1
Petroleum Refineries,57192,United States,0100000US,324110,1
"Asphalt Paving, Roofing, and Saturated Materials Manufacturing",26168,United States,0100000US,32412,1
Asphalt Paving Mixture and Block Manufacturing,15810,United States,0100000US,324121,1
Asphalt Shingle and Coating Materials Manufacturing,10358,United States,0100000US,324122,1
Other Petroleum and Coal Products Manufacturing,15708,United States,0100000US,32419,1
Petroleum Lubricating Oil and Grease Manufacturing,12451,United States,0100000US,324191,1
All Other Petroleum and Coal Products Manufacturing,3257,United States,0100000US,324199,1
Chemical Manufacturing,888737,United States,0100000US,325,1
Basic chemical manufacturing,162840,United States,0100000US,3251,1
