Residential Electric Lighting Fixture Manufacturing,6523,United States,0100000US,335131,1
"Commercial, Industrial, and Institutional Electric Lighting Fixture Manufacturing",18614,United States,0100000US,335132,1
Electric Lamp Bulb and Other Lighting Equipment Manufacturing,12562,United States,0100000US,335139,1
Household Appliance Manufacturing,57642,United States,0100000US,3352,1
Small Electrical Appliance Manufacturing,8544,United States,0100000US,33521,1
Small Electrical Appliance Manufacturing,8544,United States,0100000US,335210,1
Major Household Appliance Manufacturing,49098,United States,0100000US,33522,1
Major Household Appliance Manufacturing,49098,United States,0100000US,335220,1
Electrical Equipment Manufacturing,119871,United States,0100000US,3353,1
Electrical Equipment Manufacturing,119871,United States,0100000US,33531,1
"Power, Distribution, and Specialty Transformer Manufacturing",23996,United States,0100000US,335311,1
Motor and Generator Manufacturing,28521,United States,0100000US,335312,1
Switchgear and Switchboard Apparatus Manufacturing,35586,United States,0100000US,335313,1
Relay and Industrial Control Manufacturing,31768,United States,0100000US,335314,1
Other electrical equipment and component manufacturing,158175,United States,0100000US,3359,1
Battery Manufacturing,48626,United States,0100000US,33591,1
Battery Manufacturing,48626,United States,0100000US,335910,1
Communication and Energy Wire and Cable Manufacturing,22071,United States,0100000US,33592,1
Fiber Optic Cable Manufacturing,7206,United States,0100000US,335921,1
Other Communication and Energy Wire Manufacturing,14865,United States,0100000US,335929,1
Wiring Device Manufacturing,39550,United States,0100000US,33593,1
Current-Carrying Wiring Device Manufacturing,24954,United States,0100000US,335931,1
Noncurrent-Carrying Wiring Device Manufacturing,14596,United States,0100000US,335932,1
All Other Electrical Equipment and Component Manufacturing,47928,United States,0100000US,33599,1
Carbon and Graphite Product Manufacturing,9252,United States,0100000US,335991,1
All Other Miscellaneous Electrical Equipment and Component Manufacturing,38676,United States,0100000US,335999,1
Transportation Equipment Manufacturing,1636080,United States,0100000US,336,1
Motor Vehicle Manufacturing,252000,United States,0100000US,3361,1
Automobile and Light Duty Motor Vehicle Manufacturing,213363,United States,0100000US,33611,1
Automobile and Light Duty Motor Vehicle Manufacturing,213363,United States,0100000US,336110,1
Heavy Duty Truck Manufacturing,38637,United States,0100000US,33612,1
Heavy Duty Truck Manufacturing,38637,United States,0100000US,336120,1
Motor Vehicle Body and Trailer Manufacturing,177036,United States,0100000US,3362,1
Motor Vehicle Body and Trailer Manufacturing,177036,United States,0100000US,33621,1
Motor Vehicle Body Manufacturing,57659,United States,0100000US,336211,1
Truck Trailer Manufacturing,45182,United States,0100000US,336212,1
Motor Home Manufacturing,12643,United States,0100000US,336213,1
Travel Trailer and Camper Manufacturing,61552,United States,0100000US,336214,1
Motor Vehicle Parts Manufacturing,575338,United States,0100000US,3363,1
Motor Vehicle Gasoline Engine and Engine Parts Manufacturing,59754,United States,0100000US,33631,1
Motor Vehicle Gasoline Engine and Engine Parts Manufacturing,59754,United States,0100000US,336310,1
Motor Vehicle Electrical and Electronic Equipment Manufacturing,59943,United States,0100000US,33632,1
Motor Vehicle Electrical and Electronic Equipment Manufacturing,59943,United States,0100000US,336320,1
Motor Vehicle Steering and Suspension Components (except Spring) Manufacturing,35440,United States,0100000US,33633,1
Motor Vehicle Steering and Suspension Components (except Spring) Manufacturing,35440,United States,0100000US,336330,1
Motor Vehicle Brake System Manufacturing,19809,United States,0100000US,33634,1
Motor Vehicle Brake System Manufacturing,19809,United States,0100000US,336340,1
Motor Vehicle Transmission and Power Train Parts Manufacturing,83333,United States,0100000US,33635,1
Motor Vehicle Transmission and Power Train Parts Manufacturing,83333,United States,0100000US,336350,1
Motor Vehicle Seating and Interior Trim Manufacturing,72280,United States,0100000US,33636,1
Motor Vehicle Seating and Interior Trim Manufacturing,72280,United States,0100000US,336360,1
Motor Vehicle Metal Stamping,103323,United States,0100000US,33637,1
Motor Vehicle Metal Stamping,103323,United States,0100000US,336370,1
Other Motor Vehicle Parts Manufacturing,141456,United States,0100000US,33639,1
Other Motor Vehicle Parts Manufacturing,141456,United States,0100000US,336390,1
Aerospace Product and Parts Manufacturing,416552,United States,0100000US,3364,1
Aerospace Product and Parts Manufacturing,416552,United States,0100000US,33641,1
Aircraft Manufacturing,178922,United States,0100000US,336411,1
Aircraft Engine and Engine Parts Manufacturing,66672,United States,0100000US,336412,1
Other Aircraft Parts and Auxiliary Equipment Manufacturing,101083,United States,0100000US,336413,1
Guided Missile and Space Vehicle Manufacturing,25453,United States,0100000US,336414,1
Guided Missile and Space Vehicle Propulsion Unit and Propulsion Unit Parts Manufacturing,37683,United States,0100000US,336415,1
Other Guided Missile and Space Vehicle Parts and Auxiliary Equipment Manufacturing,6739,United States,0100000US,336419,1
Railroad Rolling Stock Manufacturing,30031,United States,0100000US,3365,1
Railroad Rolling Stock Manufacturing,30031,United States,0100000US,33651,1
Railroad Rolling Stock Manufacturing,30031,United States,0100000US,336510,1
Ship and Boat Building,148040,United States,0100000US,3366,1
Ship and Boat Building,148040,United States,0100000US,33661,1
Ship Building and Repairing,98695,United States,0100000US,336611,1
Boat Building,49345,United States,0100000US,336612,1
Other Transportation Equipment Manufacturing,37083,United States,0100000US,3369,1
Other Transportation Equipment Manufacturing,37083,United States,0100000US,33699,1
"Motorcycle, Bicycle, and Parts Manufacturing",9647,United States,0100000US,336991,1
"Military Armored Vehicle, Tank, and Tank Component Manufacturing",11931,United States,0100000US,336992,1
All Other Transportation Equipment Manufacturing,15505,United States,0100000US,336999,1
Furniture and Related Product Manufacturing,378328,United States,0100000US,337,1
Household and institutional furniture and kitchen cabinet manufacturing,235897,United States,0100000US,3371,1
Wood Kitchen Cabinet and Countertop Manufacturing,106951,United States,0100000US,33711,1
Wood Kitchen Cabinet and Countertop Manufacturing,106951,United States,0100000US,337110,1
Household and Institutional Furniture Manufacturing,128946,United States,0100000US,33712,1
Upholstered Household Furniture Manufacturing,71578,United States,0100000US,337121,1
Nonupholstered Wood Household Furniture Manufacturing,21628,United States,0100000US,337122,1
Household Furniture (except Wood and Upholstered) Manufacturing,12273,United States,0100000US,337126,1
Institutional Furniture Manufacturing,23467,United States,0100000US,337127,1
Office Furniture (including Fixtures) Manufacturing,108270,United States,0100000US,3372,1
Office Furniture (including Fixtures) Manufacturing,108270,United States,0100000US,33721,1
Wood office furniture manufacturing,13299,United States,0100000US,337211,1
Custom Architectural Woodwork and Millwork Manufacturing,47896,United States,0100000US,337212,1
Office Furniture (except Wood) Manufacturing,17518,United States,0100000US,337214,1
"Showcase, Partition, Shelving, and Locker Manufacturing",29557,United States,0100000US,337215,1
Other furniture related product manufacturing,34161,United States,0100000US,3379,1
Mattress Manufacturing,22508,United States,0100000US,33791,1
Mattress Manufacturing,22508,United States,0100000US,337910,1
Blind and Shade Manufacturing,11653,United States,0100000US,33792,1
Blind and Shade Manufacturing,11653,United States,0100000US,337920,1
Miscellaneous Manufacturing,528700,United States,0100000US,339,1
Medical Equipment and Supplies Manufacturing,289216,United States,0100000US,3391,1
Medical Equipment and Supplies Manufacturing,289216,United States,0100000US,33911,1
Surgical and Medical Instrument Manufacturing,121079,United States,0100000US,339112,1
Surgical Appliance and Supplies Manufacturing,86017,United States,0100000US,339113,1
Dental Equipment and Supplies Manufacturing,16408,United States,0100000US,339114,1
Ophthalmic Goods Manufacturing,21438,United States,0100000US,339115,1
Dental Laboratories,44274,United States,0100000US,339116,1
Other Miscellaneous Manufacturing,239484,United States,0100000US,3399,1
Jewelry and Silverware Manufacturing,18811,United States,0100000US,33991,1
Jewelry and Silverware Manufacturing,18811,United States,0100000US,339910,1
Sporting and Athletic Goods Manufacturing,37048,United States,0100000US,33992,1
Sporting and Athletic Goods Manufacturing,37048,United States,0100000US,339920,1
"Doll, Toy, and Game Manufacturing",5590,United States,0100000US,33993,1
"Doll, Toy, and Game Manufacturing",5590,United States,0100000US,339930,1
Office Supplies (except Paper) Manufacturing,8908,United States,0100000US,33994,1
Office Supplies (except Paper) Manufacturing,8908,United States,0100000US,339940,1
Sign Manufacturing,73566,United States,0100000US,33995,1
Sign Manufacturing,73566,United States,0100000US,339950,1
All Other Miscellaneous Manufacturing,95561,United States,0100000US,33999,1
"Gasket, packing, and sealing device manufacturing",27038,United States,0100000US,339991,1
Musical Instrument Manufacturing,11833,United States,0100000US,339992,1
"Fastener, Button, Needle, and Pin Manufacturing",3772,United States,0100000US,339993,1
"Broom, brush, and mop manufacturing",8657,United States,0100000US,339994,1
Burial Casket Manufacturing,2770,United States,0100000US,339995,1
All Other Miscellaneous Manufacturing,41491,United States,0100000US,339999,1
Wholesale trade,6219107,United States,0100000US,42,1
"Merchant Wholesalers, Durable Goods",3631054,United States,0100000US,423,1
Motor Vehicle and Motor Vehicle Parts and Supplies Merchant Wholesalers,446624,United States,0100000US,4231,1
Automobile and other motor vehicle merchant wholesalers,142401,United States,0100000US,42311,1
Automobile and other motor vehicle merchant wholesalers,142401,United States,0100000US,423110,1
Automobile and motorcycle merchant wholesalers,51502,United States,0100000US,4231101,1
Bus and recreational vehicle merchant wholesalers,5653,United States,0100000US,4231102,1
"Light truck and van (14,000 lb or less) merchant wholesalers",9075,United States,0100000US,4231103,1
"Medium truck and tractor (14,001 lb to 33,000 lb) merchant wholesalers",7072,United States,0100000US,4231104,1
"Heavy truck and tractor (over 33,000 lb) merchant wholesalers",69099,United States,0100000US,4231105,1
Motor Vehicle Supplies and New Parts Merchant Wholesalers,225900,United States,0100000US,42312,1
Motor Vehicle Supplies and New Parts Merchant Wholesalers,225900,United States,0100000US,423120,1
Motor vehicle supplies and new parts merchant wholesalers- warehouse distributors,74878,United States,0100000US,4231201,1
Motor vehicle supplies and new parts merchant wholesalers- jobbers,146903,United States,0100000US,4231202,1
Petroleum products marketing equipment merchant wholesalers,4119,United States,0100000US,4231203,1
Tire and Tube Merchant Wholesalers,51495,United States,0100000US,42313,1
Tire and Tube Merchant Wholesalers,51495,United States,0100000US,423130,1
Motor Vehicle Parts (Used) Merchant Wholesalers,26828,United States,0100000US,42314,1
Motor Vehicle Parts (Used) Merchant Wholesalers,26828,United States,0100000US,423140,1
Furniture and Home Furnishing Merchant Wholesalers,161209,United States,0100000US,4232,1
Furniture Merchant Wholesalers,67247,United States,0100000US,42321,1
Furniture Merchant Wholesalers,67247,United States,0100000US,423210,1
Household and lawn furniture merchant wholesalers,28369,United States,0100000US,4232101,1
Office and business furniture merchant wholesalers,38878,United States,0100000US,4232102,1
Home Furnishing Merchant Wholesalers,93962,United States,0100000US,42322,1
Home Furnishing Merchant Wholesalers,93962,United States,0100000US,423220,1
"Household china, glassware, and crockery merchant wholesalers",4424,United States,0100000US,4232201,1
"Linens, domestics, draperies, and curtains merchant wholesalers",16363,United States,0100000US,4232202,1
Floor coverings merchant wholesalers,43480,United States,0100000US,4232203,1
Other home furnishings merchant wholesalers,29695,United States,0100000US,4232204,1
Lumber and Other Construction Materials Merchant Wholesalers,268570,United States,0100000US,4233,1
"Lumber, Plywood, Millwork, and Wood Panel Merchant Wholesalers",131380,United States,0100000US,42331,1
"Lumber, Plywood, Millwork, and Wood Panel Merchant Wholesalers",131380,United States,0100000US,423310,1
Lumber without yard merchant wholesalers,16981,United States,0100000US,4233101,1
Lumber with yard merchant wholesalers,34270,United States,0100000US,4233102,1
"Plywood, veneer, millwork, and wood panel merchant wholesalers",80129,United States,0100000US,4233103,1
"Brick, Stone, and Related Construction Material Merchant Wholesalers",36785,United States,0100000US,42332,1
"Brick, Stone, and Related Construction Material Merchant Wholesalers",36785,United States,0100000US,423320,1
"Brick, block, tile, clay/cement sewer pipe merchant wholesalers",16892,United States,0100000US,4233201,1
"Sand, gravel, and stone merchant wholesalers",15802,United States,0100000US,4233202,1
"Cement, lime, and related products merchant wholesalers",4091,United States,0100000US,4233203,1
"Roofing, Siding, and Insulation Material Merchant Wholesalers",46539,United States,0100000US,42333,1
"Roofing, Siding, and Insulation Material Merchant Wholesalers",46539,United States,0100000US,423330,1
Other Construction Material Merchant Wholesalers,53866,United States,0100000US,42339,1
Other Construction Material Merchant Wholesalers,53866,United States,0100000US,423390,1
Flat glass and other construction glass merchant wholesalers,7695,United States,0100000US,4233901,1
Other construction material merchant wholesalers,46171,United States,0100000US,4233902,1
Professional and Commercial Equipment and Supplies Merchant Wholesalers,660524,United States,0100000US,4234,1
Photographic Equipment and Supplies Merchant Wholesalers,9393,United States,0100000US,42341,1
Photographic Equipment and Supplies Merchant Wholesalers,9393,United States,0100000US,423410,1
Office Equipment Merchant Wholesalers,89608,United States,0100000US,42342,1
Office Equipment Merchant Wholesalers,89608,United States,0100000US,423420,1
Computer and Computer Peripheral Equipment and Software Merchant Wholesalers,196199,United States,0100000US,42343,1
Computer and Computer Peripheral Equipment and Software Merchant Wholesalers,196199,United States,0100000US,423430,1
Computer and computer peripheral equipment merchant wholesalers,178843,United States,0100000US,4234301,1
Computer software (packaged) merchant wholesalers,17356,United States,0100000US,4234302,1
Other Commercial Equipment Merchant Wholesalers,46791,United States,0100000US,42344,1
Other Commercial Equipment Merchant Wholesalers,46791,United States,0100000US,423440,1
Restaurant and hotel equipment and supplies merchant wholesalers,34268,United States,0100000US,4234401,1
Store machines and equipment merchant wholesalers,12523,United States,0100000US,4234402,1
"Medical, Dental, and Hospital Equipment and Supplies Merchant Wholesalers",251030,United States,0100000US,42345,1
"Medical, Dental, and Hospital Equipment and Supplies Merchant Wholesalers",251030,United States,0100000US,423450,1
"Surgical, medical, and hospital supplies merchant wholesalers",233126,United States,0100000US,4234501,1
Dental equipment and supplies merchant wholesalers,17904,United States,0100000US,4234502,1
Ophthalmic Goods Merchant Wholesalers,20785,United States,0100000US,42346,1
Ophthalmic Goods Merchant Wholesalers,20785,United States,0100000US,423460,1
Other Professional Equipment and Supplies Merchant Wholesalers,46718,United States,0100000US,42349,1
Other Professional Equipment and Supplies Merchant Wholesalers,46718,United States,0100000US,423490,1
Religious and school supplies merchant wholesalers,3897,United States,0100000US,4234901,1
Other professional equipment and supplies merchant wholesalers,42821,United States,0100000US,4234902,1
Metal and Mineral (except Petroleum) Merchant Wholesalers,141633,United States,0100000US,4235,1
Metal Service Centers and Other Metal Merchant Wholesalers,139176,United States,0100000US,42351,1
Metal Service Centers and Other Metal Merchant Wholesalers,139176,United States,0100000US,423510,1
Ferrous metal service centers and sales offices merchant wholesalers,116782,United States,0100000US,4235101,1
Nonferrous metal service centers and sales offices merchant wholesalers,22394,United States,0100000US,4235102,1
Coal and Other Mineral and Ore Merchant Wholesalers,2457,United States,0100000US,42352,1
Coal and Other Mineral and Ore Merchant Wholesalers,2457,United States,0100000US,423520,1
Coal merchant wholesalers,1269,United States,0100000US,4235201,1
Other mineral and ore merchant wholesalers,1188,United States,0100000US,4235202,1
Household Appliances and Electrical and Electronic Goods Merchant Wholesalers,563675,United States,0100000US,4236,1
"Electrical apparatus and equipment, wiring supplies, and related equipment merchant wholesalers",211317,United States,0100000US,42361,1
"Electrical apparatus and equipment, wiring supplies, and related equipment merchant wholesalers",211317,United States,0100000US,423610,1
"Household Appliances, Electric Housewares, and Consumer Electronics Merchant Wholesalers",56836,United States,0100000US,42362,1
"Household Appliances, Electric Housewares, and Consumer Electronics Merchant Wholesalers",56836,United States,0100000US,423620,1
Other Electronic Parts and Equipment Merchant Wholesalers,295522,United States,0100000US,42369,1
Other Electronic Parts and Equipment Merchant Wholesalers,295522,United States,0100000US,423690,1
Communications equipment and supplies merchant wholesalers,153117,United States,0100000US,4236901,1
Electronic parts (except communications equipment) merchant wholesalers,142405,United States,0100000US,4236902,1
"Hardware, and Plumbing and Heating Equipment and Supplies Merchant Wholesalers",282385,United States,0100000US,4237,1
Hardware Merchant Wholesalers,98293,United States,0100000US,42371,1
Hardware Merchant Wholesalers,98293,United States,0100000US,423710,1
Plumbing and Heating Equipment and Supplies (Hydronics) Merchant Wholesalers,81233,United States,0100000US,42372,1
Plumbing and Heating Equipment and Supplies (Hydronics) Merchant Wholesalers,81233,United States,0100000US,423720,1
Warm Air Heating and Air-Conditioning Equipment and Supplies Merchant Wholesalers,90928,United States,0100000US,42373,1
Warm Air Heating and Air-Conditioning Equipment and Supplies Merchant Wholesalers,90928,United States,0100000US,423730,1
Refrigeration Equipment and Supplies Merchant Wholesalers,11931,United States,0100000US,42374,1
Refrigeration Equipment and Supplies Merchant Wholesalers,11931,United States,0100000US,423740,1
"Machinery, Equipment, and Supplies Merchant Wholesalers",767929,United States,0100000US,4238,1
Construction and Mining (except Oil Well) Machinery and Equipment Merchant Wholesalers,100623,United States,0100000US,42381,1
Construction and Mining (except Oil Well) Machinery and Equipment Merchant Wholesalers,100623,United States,0100000US,423810,1
Farm and Garden Machinery and Equipment Merchant Wholesalers,109292,United States,0100000US,42382,1
Farm and Garden Machinery and Equipment Merchant Wholesalers,109292,United States,0100000US,423820,1
Farm machinery and equipment merchant wholesalers- farm dealers,70910,United States,0100000US,4238201,1
Farm machinery and equipment merchant wholesalers- wholesale distributors,24915,United States,0100000US,4238202,1
Lawn and garden machinery and equipment merchant wholesalers,13467,United States,0100000US,4238203,1
Industrial Machinery and Equipment Merchant Wholesalers,356125,United States,0100000US,42383,1
Industrial Machinery and Equipment Merchant Wholesalers,356125,United States,0100000US,423830,1
Food-processing machinery and equipment merchant wholesalers,12178,United States,0100000US,4238301,1
Hydraulic and pneumatic (fluid-power) machinery and equipment merchant wholesalers,37304,United States,0100000US,4238302,1
General-purpose industrial machinery and equipment merchant wholesalers,106321,United States,0100000US,4238303,1
Metalworking machinery and equipment merchant wholesalers,28389,United States,0100000US,4238304,1
Materials handling equipment merchant wholesalers,85084,United States,0100000US,4238305,1
"Oil well, oil refinery, and pipeline machinery, equipment, and supplies merchant wholesalers",34101,United States,0100000US,4238306,1
Other industrial machinery and equipment merchant wholesalers,52748,United States,0100000US,4238307,1
Industrial Supplies Merchant Wholesalers,107943,United States,0100000US,42384,1
Industrial Supplies Merchant Wholesalers,107943,United States,0100000US,423840,1
General-line industrial supplies merchant wholesalers,6986,United States,0100000US,4238401,1
Mechanical power transmission supplies merchant wholesalers,15012,United States,0100000US,4238402,1
Welding supplies merchant wholesalers,7730,United States,0100000US,4238403,1
Industrial containers and supplies merchant wholesalers,20620,United States,0100000US,4238404,1
Industrial valves and fittings (except fluid-power) merchant wholesalers,18218,United States,0100000US,4238405,1
Other industrial supplies merchant wholesalers,39377,United States,0100000US,4238406,1
Service Establishment Equipment and Supplies Merchant Wholesalers,58468,United States,0100000US,42385,1
Service Establishment Equipment and Supplies Merchant Wholesalers,58468,United States,0100000US,423850,1
Beauty and barber shop equipment and supplies merchant wholesalers,18396,United States,0100000US,4238501,1
Custodial and janitors' equipment and supplies merchant wholesalers,14981,United States,0100000US,4238502,1
Laundry and dry-cleaning equipment and supplies merchant wholesalers,4031,United States,0100000US,4238503,1
Other service establishment equipment and supplies merchant wholesalers,21060,United States,0100000US,4238504,1
Transportation Equipment and Supplies (except Motor Vehicle) Merchant Wholesalers,35478,United States,0100000US,42386,1
Transportation Equipment and Supplies (except Motor Vehicle) Merchant Wholesalers,35478,United States,0100000US,423860,1
Aircraft and aeronautical equipment and supplies merchant wholesalers,25155,United States,0100000US,4238601,1
"Marine machinery, equipment, and supplies merchant wholesalers",5702,United States,0100000US,4238602,1
Other transportation equipment and supplies merchant wholesalers,4621,United States,0100000US,4238603,1
Miscellaneous Durable Goods Merchant Wholesalers,338505,United States,0100000US,4239,1
Sporting and Recreational Goods and Supplies Merchant Wholesalers,73249,United States,0100000US,42391,1
Sporting and Recreational Goods and Supplies Merchant Wholesalers,73249,United States,0100000US,423910,1
Toy and hobby goods and supplies merchant wholesalers,35434,United States,0100000US,42392,1
Toy and hobby goods and supplies merchant wholesalers,35434,United States,0100000US,423920,1
Recyclable Material Merchant Wholesalers,105432,United States,0100000US,42393,1
Recyclable Material Merchant Wholesalers,105432,United States,0100000US,423930,1
Iron and steel scrap merchant wholesalers- processors and dealers,40993,United States,0100000US,4239301,1
Recyclable paper and paperboard merchant wholesalers,9733,United States,0100000US,4239302,1
Other recyclable material merchant wholesalers,54706,United States,0100000US,4239303,1
"Jewelry, Watch, Precious Stone, and Precious Metal Merchant Wholesalers",40548,United States,0100000US,42394,1
"Jewelry, Watch, Precious Stone, and Precious Metal Merchant Wholesalers",40548,United States,0100000US,423940,1
"Jewelry, watch, precious stone, and silverware merchant wholesalers",37168,United States,0100000US,4239401,1
Precious metal (except ore) merchant wholesalers,3380,United States,0100000US,4239402,1
Other Miscellaneous Durable Goods Merchant Wholesalers,83842,United States,0100000US,42399,1
Other Miscellaneous Durable Goods Merchant Wholesalers,83842,United States,0100000US,423990,1
Musical instruments and supplies merchant wholesalers,4492,United States,0100000US,4239901,1
Forest products (except lumber) merchant wholesalers,5297,United States,0100000US,4239902,1
General merchandise (durable goods) merchant wholesalers,12863,United States,0100000US,4239903,1
Prerecorded media merchant wholesalers,3203,United States,0100000US,4239904,1
Fire extinguishers and fire safety equipment merchant wholesalers,17547,United States,0100000US,4239905,1
Other durable goods merchant wholesalers,40440,United States,0100000US,4239906,1
"Merchant Wholesalers, Nondurable Goods",2341928,United States,0100000US,424,1
Paper and Paper Product Merchant Wholesalers,130309,United States,0100000US,4241,1
Printing and Writing Paper Merchant Wholesalers,7861,United States,0100000US,42411,1
Printing and Writing Paper Merchant Wholesalers,7861,United States,0100000US,424110,1
Stationery and Office Supplies Merchant Wholesalers,57068,United States,0100000US,42412,1
Stationery and Office Supplies Merchant Wholesalers,57068,United States,0100000US,424120,1
Industrial and Personal Service Paper Merchant Wholesalers,65380,United States,0100000US,42413,1
Industrial and Personal Service Paper Merchant Wholesalers,65380,United States,0100000US,424130,1
